[
  {
    "id": "char_001_keke_assassin",
    "name": "刺客-柯柯",
    "cardType": "角色",
    "deck": "爆杀流",
    "mainRole": "伏击",
    "tags": ["博弈","伤害"],
    "cost": {
      "type": "休整",
      "amount": 1
    },
    "timing": "当你的本体受到伤害后",
    "skillName": "暗杀",
    "effectText": "你可以宣言一种花色，然后令对手随机展示一张手牌。若展示的牌与你宣言的花色相同，你对其本体造成1点伤害。",
    "source": "鹅"
  },
  {
    "id": "char_002_weixiaokele_assassin",
    "name": "刺客-微笑尅乐",
    "cardType": "角色",
    "deck": "爆杀流",
    "mainRole": "控制",
    "tags": ["情报","明置"],
    "cost": {
      "type": "休整",
      "amount": 1
    },
    "timing": "出牌阶段",
    "skillName": "识破",
    "effectText": "你可以宣言一种角色定位（强攻、防御、资源、控制、支援或伏击），然后选择对手角色区内一张暗置角色并将其明置。若该角色主定位与你宣言的定位相同，你对其本体造成1点伤害；若不同，其摸一张手牌。",
    "source": "鹅"
  },
  {
    "id": "char_003_qindi_sheriff",
    "name": "警长-秦帝",
    "cardType": "角色",
    "deck": "爆杀流",
    "mainRole": "强攻",
    "tags": ["伤害","卖血"],
    "cost": {
      "type": "休整",
      "amount": 1
    },
    "timing": "对手准备阶段",
    "skillName": "高压巡逻",
    "effectText": "若你已明置，你可以对对手本体造成1点伤害。此回合结束后，若对手本回合内未造成过任何伤害，你失去1点体力。",
    "notes": "此角色需先在布阵阶段明置后才能发动技能。",
    "source": "鹅"
  },
  {
    "id": "char_004_horus-lupercal_pelican",
    "name": "鹈鹕-荷鲁斯-卢佩卡尔",
    "cardType": "角色",
    "deck": "爆杀流",
    "mainRole": "控制",
    "tags": ["角色控制","伤害"],
    "cost": {
      "type": "休整",
      "amount": 2
    },
    "timing": "出牌阶段",
    "skillName": "一口吞",
    "effectText": "你可以选择对手角色区内一张角色，将其移出游戏。被移出的角色于你的下个准备阶段开始时移回其角色区，并保持移出前的明置或暗置状态。若该角色移出前为明置状态，你对其本体造成1点伤害。",
    "source": "鹅"
  },
  {
    "id": "char_005_aichitun_jester",
    "name": "小丑-爱吃豚侠",
    "cardType": "角色",
    "deck": "爆杀流",
    "mainRole": "强攻",
    "tags": ["手牌控制","伤害"],
    "cost": {
      "type": "退场",
      "text": "退场自身"
    },
    "timing": "出牌阶段",
    "skillName": "惊喜表演",
    "effectText": "令对手随机弃置两张手牌，然后摸一张手牌。若以此法弃置的牌中包含【出刀】，你对其本体造成1点伤害。",
    "source": "鹅"
  },
  {
    "id": "char_006_weixiaokele_ninja",
    "name": "忍者-微笑尅乐",
    "cardType": "角色",
    "deck": "爆杀流",
    "mainRole": "伏击",
    "tags": ["必中","回收"],
    "cost": {
      "type": "退场",
      "text": "退场自身"
    },
    "timing": "当你的本体使用【出刀】时",
    "skillName": "影步",
    "effectText": "此【出刀】于本次结算中不能被【闪避】响应。若此【出刀】造成伤害，伤害结算完毕后，将此角色从退场区洗回你的角色牌堆。",
    "source": "鹅"
  },
  {
    "id": "char_007_baizi_ninja",
    "name": "忍者-摆子",
    "cardType": "角色",
    "deck": "爆杀流",
    "mainRole": "控制",
    "tags": ["角色控制"],
    "cost": {
      "type": "休整自身",
      "text": "休整自身"
    },
    "timing": "出牌阶段",
    "skillName": "影缚封喉",
    "effectText": "选择对手1张暗置角色，该角色本回合不能明置。",
    "source": "鹅"
  },
  {
    "id": "char_008_baizi_hitman",
    "name": "专业杀手-摆子",
    "cardType": "角色",
    "deck": "爆杀流",
    "mainRole": "强攻",
    "tags": ["伤害","必中"],
    "cost": {
      "type": "退场",
      "text": "退场自身"
    },
    "timing": "出牌阶段",
    "skillName": "专业处理",
    "effectText": "对对手本体造成1点伤害。若此伤害导致对手体力降至3或以下，将此角色从退场区洗回角色牌堆。",
    "source": "鹅"
  },
  {
    "id": "char_009_weixiaokele_hitman",
    "name": "专业杀手-微笑尅乐",
    "cardType": "角色",
    "deck": "爆杀流",
    "mainRole": "强攻",
    "tags": ["伤害","角色控制"],
    "cost": {
      "type": "休整自身",
      "text": "休整自身"
    },
    "timing": "当你将对对手本体造成伤害时",
    "skillName": "无声处理",
    "effectText": "将此次伤害改为休整对手1张角色。",
    "source": "鹅"
  },
  {
    "id": "char_010_weixiaokele_bomber",
    "name": "爆炸王-微笑尅乐",
    "cardType": "角色",
    "deck": "爆杀流",
    "mainRole": "控制",
    "tags": ["标记","角色控制"],
    "cost": {
      "type": "休整",
      "amount": 1
    },
    "timing": "出牌阶段",
    "skillName": "定时炸弹",
    "effectText": "你可以指定对手角色区内一个未被占据的角色位，在该位置放置一个「炸弹」标记。「炸弹」标记不视为角色牌，但占据该角色位。于你的下个出牌阶段开始时，若此标记仍在场上，将其销毁，并对对手本体造成1点伤害，然后令其弃置一张手牌。对手可在其出牌阶段内休整1，将此标记销毁。",
    "source": "鹅"
  },
  {
    "id": "char_011_baizi_bomber",
    "name": "爆炸王-摆子",
    "cardType": "角色",
    "deck": "爆杀流",
    "mainRole": "强攻",
    "tags": ["伤害","退场"],
    "cost": {
      "type": "退场",
      "text": "退场自身"
    },
    "timing": "出牌阶段",
    "skillName": "自爆卡车",
    "effectText": "你可以将此角色退场。若如此做，根据你角色区内的己方角色数量（含此角色），每有一张，对对手本体造成1点伤害。以此法造成的伤害至多为2点。",
    "source": "鹅"
  },
  {
    "id": "char_012_baizi_bird-eater",
    "name": "食鸟鸭-摆子",
    "cardType": "角色",
    "deck": "爆杀流",
    "mainRole": "资源",
    "tags": ["回收","角色控制"],
    "cost": {
      "type": "退场",
      "text": "退场自身"
    },
    "timing": "出牌阶段",
    "skillName": "毁尸灭迹",
    "effectText": "你可以选择你退场区内的一张角色牌，将其洗回你的角色牌堆。若如此做，你可以选择对手退场区内的一张角色牌，将其移出游戏。",
    "source": "鹅"
  },
  {
    "id": "char_013_weixiaokele_morphling",
    "name": "变形鸭-微笑尅乐",
    "cardType": "角色",
    "deck": "爆杀流",
    "mainRole": "支援",
    "tags": ["复制","转化"],
    "cost": {
      "type": "休整",
      "amount": 0
    },
    "timing": "出牌阶段",
    "skillName": "变形术",
    "effectText": "你可以选择对手角色区内一张已明置角色。直到本回合结束，此角色获得该角色的技能（包括技能名与技能效果）。以此法获得技能后，你在发动该技能时仍需支付其费用并满足其时机条件。",
    "source": "鹅"
  },
  {
    "id": "char_014_baizi_party-duck",
    "name": "派对鸭-摆子",
    "cardType": "角色",
    "deck": "爆杀流",
    "mainRole": "控制",
    "tags": ["手牌控制","摸牌"],
    "cost": {
      "type": "休整",
      "amount": 1
    },
    "timing": "出牌阶段",
    "skillName": "全场干杯",
    "effectText": "你可以令对手与你各弃置一张手牌。若你以此法弃置了基本牌，你摸一张手牌。",
    "source": "鹅"
  },
  {
    "id": "char_015_weixiaokele_lobbyist",
    "name": "说客-微笑尅乐",
    "cardType": "角色",
    "deck": "爆杀流",
    "mainRole": "强攻",
    "tags": ["强化","伤害"],
    "cost": {
      "type": "休整",
      "amount": 1
    },
    "timing": "出牌阶段",
    "skillName": "火力拉满",
    "effectText": "本回合内你使用的下一张【出刀】造成的伤害+1。",
    "source": "鹅"
  },
  {
    "id": "char_016_baizi_gravy",
    "name": "肉汁-摆子",
    "cardType": "角色",
    "deck": "爆杀流",
    "mainRole": "防御",
    "tags": ["响应","转化"],
    "cost": {
      "type": "休整",
      "amount": 1
    },
    "timing": "当你的本体成为【出刀】的目标时",
    "skillName": "别打脸",
    "effectText": "弃置一张手牌，视为你使用了一张【闪避】来响应该【出刀】。",
    "source": "鹅"
  },
  {
    "id": "char_017_huihuan_defect-robot",
    "name": "故障机器人-灰焕",
    "cardType": "角色",
    "deck": "拟态流",
    "mainRole": "防御",
    "tags": ["标记","减伤"],
    "cost": {
      "type": "休整",
      "amount": 1
    },
    "timing": "出牌阶段",
    "skillName": "充能球-冰霜",
    "effectText": "每回合限一次，选择一项：①若你的充能球少于3枚，在本体牌旁放置1枚充能球；②移去1枚充能球，直到你的下个回合开始前，你受到的下一次伤害-1。",
    "source": "塔"
  },
  {
    "id": "char_018_baizi_defect-robot",
    "name": "故障机器人-摆子",
    "cardType": "角色",
    "deck": "拟态流",
    "mainRole": "强攻",
    "tags": ["标记","转化"],
    "cost": {
      "type": "休整",
      "amount": 1
    },
    "timing": "出牌阶段",
    "skillName": "充能球-闪电",
    "effectText": "每回合限一次，选择一项：①若你的充能球少于3枚，在本体牌旁放置1枚充能球；②移去1枚充能球，视为对对手本体使用1张【出刀】。此【出刀】不计入你本回合使用【出刀】的次数。",
    "source": "塔"
  },
  {
    "id": "char_019_dong_defect-robot",
    "name": "故障机器人-dong",
    "cardType": "角色",
    "deck": "拟态流",
    "mainRole": "资源",
    "tags": ["标记","强化"],
    "cost": {
      "type": "休整",
      "amount": 1
    },
    "timing": "出牌阶段",
    "skillName": "充能球-等离子",
    "effectText": "每回合限一次，选择一项：①若你的充能球少于3枚，在本体牌旁放置1枚充能球；②移去1枚充能球，本回合你下一次发动角色技能时，若其费用为【休整X】，则X减少1，最低为0。此效果不影响【休整自身】与【退场】费用。",
    "source": "塔"
  },
  {
    "id": "char_020_baizi_ironclad",
    "name": "铁甲战士-摆子",
    "cardType": "角色",
    "deck": "",
    "mainRole": "强攻",
    "tags": ["卖血","强化"],
    "cost": {
      "type": "休整",
      "amount": 1
    },
    "timing": "出牌阶段",
    "skillName": "恶魔形态",
    "effectText": "你可以失去1点体力。若如此做，本回合内你使用的下一张【出刀】造成的伤害+1，且该【出刀】被【闪避】抵消后你可以摸1张手牌。",
    "source": "塔"
  },
  {
    "id": "char_021_xiaoapan_warlock",
    "name": "术士-小阿潘",
    "cardType": "角色",
    "deck": "",
    "mainRole": "强攻",
    "tags": ["手牌控制","伤害"],
    "cost": {
      "type": "休整",
      "amount": 2
    },
    "timing": "出牌阶段",
    "skillName": "暗影契约",
    "effectText": "你可以弃置两张手牌，对对手本体造成1点伤害，然后你摸1张手牌。若弃置的牌中有【出刀】，改为造成2点伤害。",
    "source": "鹅"
  },
  {
    "id": "char_022_weixiaokele_goblin",
    "name": "埃德加-微笑尅乐",
    "cardType": "角色",
    "deck": "",
    "mainRole": "强攻",
    "tags": ["回复","伤害"],
    "cost": {
      "type": "休整自身",
      "text": "休整自身"
    },
    "timing": "出牌阶段",
    "skillName": "血之渴望",
    "effectText": "本回合内你使用【出刀】造成伤害后，若该伤害≥2，你回复1点体力。",
    "source": "荒"
  },
  {
    "id": "char_023_arthur_falcon",
    "name": "猎鹰-Arthur",
    "cardType": "角色",
    "deck": "",
    "mainRole": "防御",
    "tags": ["响应","手牌控制"],
    "cost": {
      "type": "休整",
      "amount": 1
    },
    "timing": "当你使用【闪避】抵消【出刀】后",
    "skillName": "俯冲反击",
    "effectText": "对手须弃置一张手牌。若其无法弃置，你摸1张手牌。",
    "source": "鹅"
  },
  {
    "id": "char_024_weixiaokele_ironclad",
    "name": "罗莎-微笑尅乐",
    "cardType": "角色",
    "deck": "",
    "mainRole": "防御",
    "tags": ["减伤","标记"],
    "cost": {
      "type": "休整自身",
      "text": "休整自身"
    },
    "timing": "出牌阶段",
    "skillName": "藤蔓护甲",
    "effectText": "将至多2张手牌正面朝下置于你的本体牌旁，称为“藤蔓”标记；你的本体上至多有2枚“藤蔓”标记。直到你的下个回合开始前，当你将受到伤害时，你可以将1枚“藤蔓”标记置入共用手牌弃牌区，令此次伤害-1。你的下个回合开始时，将剩余的“藤蔓”标记置入共用手牌弃牌区。",
    "source": "荒"
  },
  {
    "id": "char_025_baizi_high-priest",
    "name": "大祭司-摆子",
    "cardType": "角色",
    "deck": "",
    "mainRole": "防御",
    "tags": ["减伤","摸牌"],
    "cost": {
      "type": "退场",
      "text": "退场自身"
    },
    "timing": "当你的本体受到伤害时",
    "skillName": "圣光庇护",
    "effectText": "将此角色退场，防止本次伤害，然后你摸1张手牌。",
    "source": "鹅"
  },
  {
    "id": "char_026_miaosila_neo",
    "name": "涅奥-喵斯拉",
    "cardType": "角色",
    "deck": "",
    "mainRole": "资源",
    "tags": ["回收","手牌控制"],
    "cost": {
      "type": "休整",
      "amount": 1
    },
    "timing": "出牌阶段",
    "skillName": "全息备份",
    "effectText": "展示1张手牌，从共用手牌弃牌区选择1张与其同名的牌加入手牌。",
    "source": "塔"
  },
  {
    "id": "char_027_weixiaokele_medium",
    "name": "通灵者-微笑尅乐",
    "cardType": "角色",
    "deck": "",
    "mainRole": "资源",
    "tags": ["布阵","退场"],
    "cost": {
      "type": "休整自身",
      "text": "休整自身"
    },
    "timing": "出牌阶段",
    "skillName": "亡魂附身",
    "effectText": "从己方退场区选择1张角色暗置上阵。以此法上阵的角色本回合离开角色区时，改为退场。结束阶段，若其仍在场，将其退场。",
    "source": "鹅"
  },
  {
    "id": "char_028_arthur_undertaker",
    "name": "殡葬者-Arthur",